{
  "schema": "witsoc.memory-entry.v1",
  "kind": "OBSTRUCTION",
  "target_sha256": "0000000000000000000000000000000000000000000000000000000000000000",
  "domain": "example",
  "scope": {},
  "status": "RECORDED",
  "admission_ref": null,
  "evidence_refs": ["sha256:example"],
  "content": {"statement": "A synthetic obstruction."},
  "tags": ["example"],
  "created_at": "2026-01-01T00:00:00+00:00",
  "invalidated_by": null,
  "entry_id": "0000000000000000000000000000000000000000000000000000000000000000"
}
